text,true_label,pred_label
finnish ahlstrom corporation double investment new specialty glassfiber reinforcement plant south carolina u,2,1
connectivity unit e invoice customer number annual transaction stand nearly one million,1,1
serving customer locally one cornerstone customer focus u,1,1
fixed term contract mr jarmo ukonaho current general manager incap indian operation finish end year,1,2
capman haavisto responsible group finance accounting,1,1
electricity requirement network grow new mobile generation,1,2
lowering price u competitor show real estate market stabilised returned balance apartment acquiring fair price eye client,2,1
price talk mid market swap plus bps area lead barclays bnpp ubs cba,1,1
january june diluted loss per share stood eur versus eur first half,0,0
value confirmed aircraft order total eur bn,1,1
okmetic global customer base sale network production plant finland u contract manufacturer japan china,1,1
international sale rose eur mn,2,2
cardona slowed vehicle turned around returned intersection called,1,1
national conciliator juhani salonius met party wednesday said far apart view propose mediation,0,1
london afx uk european broker recommendation issued today collated afx news range market source,1,1
stable outlook reflects nokia strong market position global mobile handset market strong cash flow generation conservative balance sheet said raab,2,2
company net sale totalled meur operating margin per cent,1,1
metsaliitto however narrowed net loss second quarter mln euro mln mln euro mln year ago,2,2
acando ab acanb s fell percent kronor lowest close since dec,0,0
comptel slipped net loss eur profit eur previous year,0,0
stock exchange release sanoma published annual report financial statement first corporate responsibility report,1,1
poyry global consulting engineering firm focusing energy forest industry infrastructure environment sector,1,1
nordea pankki suomi oyj ownership stonesoft corporation decreased,1,1
earnings per share eps seen eur eur,2,0
divestment raisio margarine business may gave company clearer focus grain based product,2,1
cargo volume increased approximately,2,1
finland based stockmann group closed seven franchising sport store nike russia,0,1
paper company real calculated biscuit carton made using gsm lighter board co saved course month would equal generated driving km car,1,1
outokumpu steel mill tornio finland suspected source,0,1
value deal estimated sek sek,1,1
value order eur mn,1,1
le lay succeeds walter g nter based finland,1,1
according rehu managing director jouko lahtinen project stabilise cost improve supply security,2,2
nurminen logistics provides high quality logistics service railway transport terminal service forwarding special heavy transport medical transport,1,1
finnish aktia group operating profit rose eur mn first quarter eur mn first quarter,2,2
company ready invest fund deal rostelecom rts rtkm,2,1
adpnews feb finland based steel maker rautaruukki oyj hel rtrks ruukki said today slipped larger expected pretax loss eur million usd fourth quarter,0,0
acquisition part ramirent central eastern european growth strategy,1,2
autotank group part aspo system division,1,1
member oneworld alliance includes american airline british airway,1,1
contract also includes cutting edging wagon part ruukki steel service centre seinajoki raahe delivered vr welding assembly,1,1
lemminkainen talo oy lahti office significant logistics business premise constructor,1,1
following registration share capital biotie eur,1,1
november finnish office furniture maker martela oyj hel mara said today make redundant three people nine laid permanently company office staff factory worker,0,0
area highly valued land already built,1,1
operating result month period decreased profit eur turnover decreased eur compared,0,0
result expected late,1,0
rapala said estimate make saving mln eur year centralising french operation one site,2,2
plant would use palm oil certified roundtable sustainable palm oil rspo,1,1
london leading share today jumped almost point market opened,2,2
simultaneously merger plan another merger plan signed according suomen projektivuokraus oy subsidiary vtm rakennuskonevuokraamo oy would merged vtm rakennuskonevuokraamo oy,1,1
give bedroom cool makeover summer,1,1
course talk coming new project involve material handling konecranes president ceo pekka lundmark said asked whether talking reliance industry supplying equipment upcoming refinery jamnagar,1,2
basware connectivity service allow company handle purchase pay process online make internal process efficient said ceo ilkka sihvo basware corporation,2,1
according finnish russian chamber commerce major construction company finland operating russia,1,1
august latvijas finieris ordered production line new green veneer mill built ukmerge central lithuania,1,1
swiss franc surged record euro reported sharpest gain manufacturing march,2,2
company use asset strengthening balance sheet financial position,2,1
sale department store division hobby hall increased sale clothing store subsidiary seppala decreased,2,2
finnish operator elisa aker yard signed long term service deal elisa deliver necessary voice data service aker yard finland,2,2
second quarter net sale operator business partner represented group total net sale,1,1
neste oil extended yesterday gain put pct eur utility fortum shed pct eur,1,1
previously company anticipated operating profit improve period,2,2
niam offer financial investor high return via investment fund turn invest type property,1,1
arrangement apply group unit outside finland,1,1
finnish department store group stockmann planning acquire eur mn directed issue right offering,1,1
neste oil refinery combined crude oil refining capacity approximately barrel day,1,1
penttil vision important reason transaction russia,1,1
according notice skandinaviska enskilda banken ab publ helsinki branch august divested total alma medium share ilkka yhtyma oyj kaleva kustannus oy condition agreement made company july fulfilled,1,1
ahlstrom corporation stock exchange announcement total new share ahlstrom corporation subscribed option right company stock option program ii,1,1
furthermore bunge also sign licensing agreement sunnuntai carlshamn mejeri brand,2,2
possible personnel reduction concern approximately people,0,1
company well positioned brazil uruguay,2,1
omx helsinki index pct lower omx helsinki cap portfolio index pct,0,0
viking line stx finland said monday plan build million euro ferry would launched turku stockholm route spring,1,1
componenta increased stake turkish steel company doktas dokumculuk ticaret sanayi pct stake march,2,1
dutch publisher de vijver said today agreed buy stake belgian weekly magazine humo finnish medium company sanoma hel saa v,1,1
warmly welcome michael frei outotec,2,1
addition existing service counter area reception hall rebuilt access provided local rail connection,1,1
group consolidated net sale totaled billion euro employ approximately person,1,1
netcom expects complete turbo g deployment area year,1,2
fiskars cash flow operating activity amounted eur eur previous year,2,2
restructuring upm average paper machine capacity europe ton short ton coated magazine paper ton short ton coated fine paper,1,1
fair value company investment property went eur bn end september eur bn year earlier,0,2
moody said gave p long term senior unsecured p p short term debt rating finnish lender aktia bank eur bn usd bn euro medium term note emtn program march,1,1
part transaction real sappi also signed long term agreement supply pulp bctmp smaller service supply,2,2
swedish finnish danish listed company organized three market cap segment nordic large cap mid cap small cap,1,1
russian government contribute necessary fund said,1,2
value total investment eur mn,1,1
finnish rautaruukki awarded contract supply install steel superstructure partihallsf rbindelsen bridge gothenburg sweden,2,2
may finnish liquid handling product diagnostic test system maker biohit oyj hel biobv said today may net loss narrowed eur usd first quarter eur period,2,2
non recurring cost caused talentum premedia business area restructuring amount mln euro mln included company financial result second quarter,1,2
percentage share voting right calculated proportion total number share registered trade register total number voting right related,1,1
according mark white locatrix communication ceo company web service interface allows device owner friend family track locate twig user via web browser,1,1
cash flow operation rose eur mn eur mn,2,2
company market share continued increase,2,2
adpnews jun finnish stainless steel maker outokumpu oyj hel v said yesterday signed three year eur million usd bn revolving credit facility,2,2
value three year contract estimated eur,1,1
amer sport divests industrial site rumilly france announcement distributed thomson reuters behalf thomson reuters client,1,1
finnish company previously said operating result lower break even posted year earlier,0,0
thanks wide contact network good knowledge market business environment give great contribution development indian operation tell incap president ceo juhani hanninen,2,1
pricing detail disclosed,1,1
service also enables user watch e mail html format en enhanced addition language choose,1,1
rising cost forced packaging producer huhtamaki axe job hampshire manufacturing plant,0,1
export account one tenth company annual turnover one billion kroon,1,1
subscriber browse free number handset select number package service prefer activating phone,1,1
rapala vmc corporation rapala leading fishing tackle sporting good manufacturer distributor main owner peltonen shareholding,1,2
finnish plumbing heating system supplier uponor net sale continuing operation decreased eur mn eur mn,0,0
rapala vmc corporation rapala finland based company engaged manufacture distribution fishing equipment accessory,1,1
third quarter net sale increased year year eur million comparable currency rate growth,2,2
dividend payable annually shall deducted share subscription price,1,1
company operating income ebit totalled eur mn eur mn year year,2,2
china based operation enable u fully leverage resource expertise wireless solution also strengthen capability offer industry leading product customer china,2,2
world leader developing uv technology municipal wastewater drinking water industrial water treatment system trojan technology logical partner providing w rtsil uv technology ballast water treatment,1,2
sysopen digia signed agreement main shareholder sentera holding total share capital vote sentera,2,1
oxyview pulse oximeter common device check patient blood oxygen saturation level pulse rate,1,1
target net sale set eur bn target return investment,2,2
remainder revenue come technology agreement firm interdigital said,1,2
purchase cramo become second largest rental service provider latvian market,2,2
scheme teliasonera altimo practically identical except involves merger stake vimpelcom kyivstar,1,1
operating profit non recurring item eur mn first nine month compared eur corresponding period,0,0
aim ensure vacon good shape capital expenditure start pick comment vacon plc president ceo vesa laisi,2,1
training module aim strengthening public accounting ability fulfilling communal project management,2,1
ensure low operational cost radio network bts module configured software upgraded diagnosed remotely,2,2
finland leading metal group outokumpu said fourth quarter net profit tripled back strong global demand stainless steel soaring base metal price proceeds sale technology unit,2,2
glaston glass processing unit tamglass glass processing manufacturer high quality safety glass product operates finland,1,1
operating profit three month period increased eur revenue increased eur compared corresponding period,2,2
founded strand associate provides civil environmental transportation electrical mechanical engineering service employee office wisconsin alabama illinois indiana kentucky ohio,1,1
expenditure must justified pas budget approval hurdle believe rop model help make easier security practitioner make business case acquiring enabling security technology related control activity,1,1
operating profit excluding non recurring item decreased eur mn eur mn representing net sale,0,0
finnish technology company raute corporation omx helsinki rutav issued tuesday september profit warning financial year,0,0
finland poyry energy contract advise builder new cogeneration power plant lithuania second biggest city kaunas supervise construction process,2,1
helsinki afx kesko corp expected report lower second quarter eps today due tax charge earnings line seen higher year year analyst said,0,2
tecnomen system feature new range value added service prepaid post paid billing charging rating voice call data traffic kind content service mobile fixed network,1,1
according ultrascan software acquired cracker managed change mobile phone way phone able get hold one time password sent bank via text message,1,1
part reorganisation pohjola insurance field staff private customer join payroll local cooperative bank beginning october,1,1
total value deal usd mn,1,1
volume expected increase next year,2,2
shopping center opened st petersburg russia november turn cash flow finnish department store chain stockmann russian operation positive first time,2,2
remote radio head module available w power ghz ghz tdd frequency band,1,1
finnish developer manufacturer mobile phone charger salcomp plc omx helsinki sal v wednesday november lowered full year net sale estimate,0,1
finnish elevator escalator maker kone corporation said tuesday march received major order sir robert mcalpine supply elevator escalator watermark place project city london,2,2
currency conversion based exchange rate time deal,1,1
method system controlling hard disk drive using multimediacard physical interface invented marko ahvenainen ruutana finland,1,1
cooperation double switch converter capacity,2,2
total amount subscription price recorded fund invested non restricted equity,1,1
newspaper alma medium arena partner enter cooperation agreement using alma marketplace service respective region,1,1
according finnish fim bank alpro price would around eur mn mn,1,1
finnish financial software solution developer basware oyj said net profit fell euro mln first quarter mln euro mln year earlier,0,0
upm stock fell percent euro early afternoon trading helsinki,0,0
marimekko also opened concept store yokohama nagoya central japan silver spring metropolitan washington dc usa graz central austria aalborg northern denmark,2,1
adpnews aug finnish medium group ilkka yhtyma oyj hel ilk said today net profit fell year eur million usd first half,0,0
stora enso oyj largest papermaker october said would close four mill,0,0
strategic cooperation rentakran brings u new customer already working relationship authority new territory said jarmo laasanen senior manager cramo,2,2
banking sampo unchanged eur nordea rose pct eur,2,2
truly take efficiency new height mr metso add,2,2
operating profit rose eur mn eur mn corresponding period,2,2
hour news try icis news www icis com click trial icis news,1,1
master mayawas jointly developed nokia siemens network ufa fremantlemedia actively advertised maxi end may,1,1
writing publication lemmink inen history continuation earlier collaboration antti tuuri company,1,1
product coverage baked good biscuit breakfast cereal data coverage market size historic forecast company share brand share distribution data,1,1
investment place atrium plan expand moscow market,1,2
operating income rose eur mn eur mn,2,2
operating profit month period decreased eur net sale increased eur compared,0,0
ramirent leading company machinery equipment rental construction industry,2,2
choose efficient best overall value option customer already bidding stage,2,1
ministry water tanzania awarded poyry water sanitation engineering assignment rehabilitation extension water supply sanitation infrastructure bukoba musoma situated lake victoria northern tanzania,2,2
increase range vary,1,2
chain unite centre end,1,1
finnish bank pohjola bank plc hel poh said today issue eur million usd index linked bond pohjola tutkimuksen tahdet viii pohjola research star viii october,1,1
neste oil said result biomass liquid demonstration plant commissioned june promising decision commercial plant taken,1,1
raute corporation received order worth eur million ooo ilim bratsk dok russia,2,1
company reported today operating loss eur net sale eur first quarter,0,1
omx helsinki index pct helsinki cap portfolio index pct higher,2,1
business goal realize temporary lay offs carried summer saving measure,1,0
several innovative small molecule biological drug candidate different stage clinical development,1,1
million tonne co eua eu allowance emission credit eu traded underlying market value approx,1,1
tool specifically designed need business user ict expert mind,1,1
inspects company strategic strength weakness,1,2
veidekke headquartered oslo norway scandinavian construction property development group employee norway sweden denmark annual turnover nok bn,1,1
company continuous need alloy nickel ferro chrome molybdenum manganese production said talvivaara,1,2
lassila tikanoja operating profit excluding non recurring imputed item second quarter eur eur year ago,0,0
annual general meeting approved dividend eur per share total eur million,1,1
spokeswoman italian fashion house declined comment settlement,1,1
agreement signed biohit healthcare ltd uk based subsidiary biohit oyj finnish public company develops manufacture market liquid handling product diagnostic test system,2,2
new kveyt light variety suomalainen pekoni marketed atrium brand name available consumer finland,2,1
well known brand include fitness equipment maker precor u based ball sport equipment maker wilson,1,1
could u time said,1,2
satama trainer house remain name independent brand business area,1,1
board director authorized decide term share issue,1,1
apple spokeswoman said company declined comment,1,0
one headboxes equipped modern consistency control system ensure cross machine profile plasterboard,1,1
eps dropped eur eur,0,0
order also includes extensive maintenance work shoe press delivered vaahto,1,1
operating profit fell eur mn eur mn,0,0
self service automation bigger role fujitsu global resource exploited effectively,2,1
central europe important market area honka,1,1
challenge company however finding new source raw material said risto rinne ceo neste oil,1,1
profitable make pulp paper sawn good area combination factor good,1,2
cargotec sale totalled eur billion employ approximately people,1,1
also technopolis plan build million euro technology park special economic zone neudorf st petersburg st petersburg government said february,1,1
leading private road ambulance service company finland,2,1
offer price million including cash million net debt assumption face million worth cencorp share issued savcor,1,1
implementation project carried finnish company yit association investment fund evli property investment russia epi,1,1
teleste acquisition mark entry service business market long established significant supplier product,2,2
firm headquartered vantaa southern finland employee,1,1
succeeded increasing market share sold apartment comment mr kari kauniskangas head yit international construction service,2,2
sonoco product co u packaging company said friday bought percent italy demolli industria cartaria spa already,1,2
according hkscan finland plan increase j rvi suomen portti net sale eur mn eur mn,2,2
stonegate product centrally manageable suited physical virtual environment,1,1
due pirkka beer olvi brewery iisalmi moving day hour work shift,1,1
payment date march,1,1
company reported net sale mln euro mln operating margin pct,1,1
proud welcome another distribution facility north mississippi region known logistics center united state said gray swoope executive director mda,2,1
also traditional grapevine carry lot weight,1,1
company net sale amounted approximately eur employee,1,1
customer wide range industry use stainless steel service worldwide,1,1
engine electrical output kw making largest gas powered generating set world,1,1
financial detail disclosed,1,1
business unit investlesprom group cover full forest industry chain group owns forest sawmill paper pulp mill processing plant,1,1
return flight stuttgart every morning well evening departure thursday friday sunday,1,2
term acquisition disclosed,1,1
real generated turnover eur bn employee,1,1
ahms also offer hotel hotel project consultancy management service brand franchise training sale marketing service pan india basis,1,1
preliminary estimation technology park measure square meter,1,1
estimated consolidated turnover kausta guder reach lt mn u mn eur mn,1,2
offer deemed low finnlines board stand pm tomorrow,0,1
dollar bounced back hitting another record low euro reached first time,1,2
founded quatrocon clientele consists public sector builder central trading company major construction firm,1,1
also confirmed earnings guidance whole issued report whole,1,0
thanks nokia lulu proud published novel found,1,1
helsinki afx cargotec said bought pct stake indital construction machinery ltd bangalore based company make fork lift truck mobile crane undisclosed sum,1,1
tikkurila powder coating employee four paint plant generated revenue eur usd,1,1
tinyurl link take user scamming site promising user earn thousand dollar becoming google nasdaq goog cash advertiser,0,1
project expected completed,1,1
nwc analysis,1,1
aspo also investigated sale opportunity kaukomarkkinat electronics business,1,1
also bringing right kind people upgrade human resource,2,1
finnish construction company yit hel yty v said agreed take german facility engineering facility system firm caverion eur usd,1,2
helsinki afx share closed higher led nokia announced plan team sanyo manufacture g handset nokian tyre fourth quarter earnings report beat analyst expectation dealer said,2,1
currently ten shop selling tikkurila paint kazakhstan shop opened continuously,1,1
demand brisk expected order level remained high,2,2
finnish company claim quarter million contented tulikivi fireplace business homeowner worldwide,1,1
cramo group financial target sale growth higher percent per year return equity percent,2,2
delivery started april completed,1,1
upm kymmene one world leading printing paper producer production country sale network covering company,2,2
airline ordered nine airbus aircraft delivery becomes lead airline latest variant roll royce trent series engine called,2,1
net sale vegetable oil business rose eur mn eur mn,2,2
current lay offs additional temporary lay offs agreed december may,0,0
completion transaction subject final agreement due diligence process,1,1
course direct access nokia ovi store lot fun downloading favorite medium,1,1
strong growth continued also china,2,2
forestry also higher driven yesterday bullish analyst comment stora enso dagens industri dealer said,2,2
kirsi rantanen previously development director hk ruokatalo poultry business,1,1
option might include partial total divestment shareholding ovako,1,1
met located central business district cbd bangkok,1,1
image data produced browser phone server converted bitmapped image sent handset display,1,1
earnings per share eps amounted eur loss eur,2,2
contract includes heating plant equipment associated installation work,1,1
one largest project magazine division sanomawsoy sanoma magazine international became launch russian magazine gloriya,1,1
largest restructuring planned italy negotiation job cut initiated today company noted,0,0
antibody given repeated dos mg kg generally well tolerated pharmacokinetic characteristic btt psoriasis patient consistent observed previously completed study rheumatoid arthritis ra patient,2,1
kauko telko centralized administration dissolved appropriate part transferred operating activity group administration end year,1,1
raw material come europe u paid euro u dollar sale take place ruble,1,1
ponsse divide sale maintenance service network six geographical area,1,1
facade riga march finnish construction company yit oyj hel yty v said today build frame facade tower construction project riga,1,2
opportunity responsibility create new journalistic culture serve reader alma medium newspaper say hannu ollikainen head new helsinki desk,1,1
upm aim secure botnia strategic development investment,1,1
finland national carrier finnair plc carried record million passenger increase percent previous year airline reported tuesday,2,2
incident happened p avenue road,1,1
webcast may followed online company website www ruukki com investor,1,1
world second largest stainless steel maker said net profit three month period dec surged euro million u million euro u per share euro million euro per share previous year,2,2
finnish cargotec kalmar business area providing container handling solution awarded order ten e one rubber tyred gantry rtg crane saigon newport company snp vietnam,2,2
maritime administration said ship ignored warning icy condition,0,0
company said share holding company sold meadville holding limited hong kong listed parent company meadville group,1,1
made long term investment developing system implementation model,1,2
finnish sport equipment company amer sport said decided lay worker salomon division france,0,2
result total employee would given notice,1,0
share repurchase helsinki stock exchange behalf sampo plc danske bank helsinki branch,1,1
quartal oy owns share satama interactive plc represents per cent share capital voting right,1,1
consolidated operating profit excluding one item eur mn eur mn year earlier,2,0
operating profit decreased eur mn eur mn,0,0
honkarakenne mainly export large luxury log house russia used one family house holiday home sale go moscow region st petersburg region remainder location,1,1
