text,true_label,pred_label
expects revenue billion billion compared analyst estimate billion,1,2
contract signed yesterday run five year includes two year extension option,1,1
reason st petersburg status capital one participant meeting quoted chikunov saying,1,1
earn payment mln euro mln also paid depending intellibis financial performance,1,1
clothing retail chain sepp l sale increased eur mn operating profit rose eur mn eur mn,2,2
offer client integrated management consulting total solution complex project efficient best class design supervision,1,1
earnings per share quarter also higher year year eur versus market expectation eur,2,2
super nasty said eric schultze chief technology officer shavlik technology llc st paul minn based maker patch management tool,0,2
ev device involved action,1,1
profit period increased eur mn eur mn,2,2
sukhraj dulai block boni sue court cul de sac city north side started vehicle went inside house tuesday leaving garage door open,1,2
group net sale third quarter totaled eur mn operating profit eur mn,1,1
solvay engaged poyry provide project management engineering procurement site service hydrogen peroxide production plant built solvay basf joint venture basf zandvliet site belgium,1,1
move triggered weak demand forestry equipment uncertain market situation,0,0
later finnish made house build area,1,1
renzo piano building design wonderful addition london skyline say noud veeger evp area director central north europe kone,2,1
tvo two unit mw olkiluoto plant generated twh operating ratio across reactor company described high international standard,1,1
use natural fiber make clothes comfortable allow skin breathe eco friendly,2,1
however net sale declined eur million eur billion,0,0
yesterday legrand issued e million fixed rate deal maturing,1,1
finnish paper maker upm kymmene corp monday announced sale wrapping unit walki wisa capman investment group move concentrate core business,1,1
adp news sep finnish security privacy software solution developer stonesoft oyj said today usd million eur order deliver stonegate network security product unnamed russian te,2,2
repurchase bond executed open market accordance section f term condition convertible bond,1,1
deal significant effect acquiring company equity ratio,1,1
via plant belgian company feed mw electricity distribution grid able deliver mw heat,1,1
january finnish technology center operator technopolis oyj hel tps v said today invest eur construction second phase office facility tampere,1,1
alma medium operating profit amounted eur mn eur mn year earlier,0,0
acquisition part suomen helasto strategy expand lukkoexpert security chain suomen helasto ceo kimmo uusimaki said,1,2
agreement direct result lcc strategy plan announced earlier year said dean douglas lcc chief executive officer,1,0
decided auditor reimbursed according invoice,1,1
result transaction aggregate holding burrill life science capital fund l p decreased per cent total number share vote company,0,0
implementation upgrade existing system enabling voicemail video mail housed platform,1,1
focus improving profitability next year streamlining operation,2,2
low energy consumption flexible loading advantage chf pro,1,1
implementation deal subject approval finnish competition authority,1,1
september finnish group agreed buy danish company rose poultry eur combination cash stock,2,2
exercise price option based safran software solution license maintenance sale well result company,1,1
finnish industrial group ruukki group brought counter action finnish metal company rautaruukki dispute concerning name company,0,2
release offer security sale united state elsewhere,1,1
etteplan reported turnover eur,1,1
country finland sector construction real estate target pohjolan design talo oy buyer capman oyj vendor ruukki group oyj deal size usd type divestment status agreed,1,1
group reiterated forecast handset manufacturer sell around mln unit year globally,1,1
initial estimated total value contract euro excluding vat,1,1
additionally information business segment competitor future outlook provided,1,1
ore body sufficient support anticipated production least year,1,2
change envisaged hk ruokatalo would reduce number industrial place business finland eight six,1,1
autumn plan expand service st petersburg moscow launch service yekaterinburg russia flying three time week,2,2
also lemmink inen profit accounting period went eur mn eur mn year ago,2,0
finnair tallinn based subsidiary aero carried passenger decline route helsinki baltic capital within southern finland,0,0
finnish bank land report operating profit eur mn first quarter eur mn corresponding period,0,0
operating loss totaled eur mn compared profit eur mn corresponding period,0,0
finnish fiber plastic product maker suominen corporation said net loss continuing operation narrowed mln euro mln mln euro mln,2,2
result company temporarily lay whole personnel approximately person kirkkonummi nivala factory,0,0
potential client include public administration organization investing utility network service,1,1
schwalm outotec com eila paatela vice president corporate communication tel mobile e mail eila,1,1
dividend go grimaldi family,1,1
split number k share number share,1,1
company advantage pricing seen significantly lower price offered new unmanned station,2,1
export grew percent million liter,2,2
p kept sell rating nordea ubs reaffirmed buy recommendation,1,2
adjustment concern staff specialty paper fiber composite segment,1,1
efficiency program totalling million euro way finnair,2,1
cdp established initiative institutional investor however annually published result also interest increasing number customer interest group reporting company,1,1
omx helsinki ended pct lower omx helsinki pct bln eur turnover,0,0
group ebit first half eur u falling short eur posted period,0,0
local government commissioner l kurt svensson say contact management finnish company componenta find alternative company decision close plant l,1,2
agreement expired earlier month,1,2
net profit mln compared mln,2,0
suomen paikallissanomat oy part alma medium group currently publishes local newspaper across finland,1,1
time sale development russia boosted opening stockmann nevsky centre st petersburg,2,1
equipment expand container handling capacity namibia main port walvis bay west coast,2,2
fortum considering taking part nuclear energy project outside finland,1,1
lithuanian beer market made million liter january rise percent year earlier figure lithuanian brewer association reporting citing result member,2,2
alexandria va jan united state patent issued jan assigned kemira chemical inc marietta ga,1,1
according company staff laid temporarily necessary,0,0
share purchase completed financing also provided expand latvia broadband infrastructure develop new area business including acquisition company,2,1
process technology project management basic engineering quality assurance within forest industry consolidated vantaa southern finland,1,1
joint venture invest eur production technology straight away,1,1
social plan negotiation part three year turn around program expected ensure salomon future competitiveness,2,2
building condominium built stage,1,1
acquisition expected improve access chrome ore resource turkey,2,1
board director also proposed dividend eur per outstanding share paid,1,1
job transferred finland however,2,1
adp news feb finnish fishing tackle company rapala vmc corp hel rap v said today net profit rose eur million usd eur million,2,2
known post bank concept would see fidelity bank rolling office ghana post premise provide financial service people,2,1
acquisition financed billion debt arranged goldman sachs co,1,1
thereby company expand offering north central south america,2,2
operating profit net sale three month period increased respectively eur eur compared corresponding period,2,2
rautakesko business operation norway russia acquired july included figure comparable period impacting sale growth starting august,1,2
finnish financial software developer basware oyj said today provide invoice automation ia solution unnamed major retail company usa deal worth eur,2,2
teleste office worldwide listed nordic exchange helsinki,1,1
earnings per share eur,1,2
price gmo soy lower non gmo,1,0
resident access block planned aleksandri street,1,1
company operates business two reportable segment including banking investment service non life insurance,1,1
however increase signaling traffic waste network resource allows fewer smartphones connect,0,2
ahlstrom corporation stock exchange release ahlstrom global leader high performance fiber based material today announced completion acquisition friend group inc consists west carrollton parchment company west carrollton converting company,1,1
winner included honda odyssey minivan nissan armada large suv,1,1
operating profit fell eur mn eur mn including vessel sale gain eur mn,0,0
company also said sell approximately hectare land city valkeakoski end year part job job program,1,0
hobby hall sale decrease pct due implementing new information system involved changing principal posting sale,0,1
efore decided establish company eletric vehicle ev business china,1,1
diluted loss per share stood eur versus eur,2,2
ruukki forecast annual sale growth positive pretax result,2,2
contract value amount eur million,1,1
would premature talk date volume investment procedure said,1,1
yit kausta build commercial residential highrises virsuliskes area,1,1
proving good cellphone design truly work art website nokia provides colorful canvas expression mobile inspired sentiment,2,1
juha haapakoski continue editor chief budget responsibility also new publisher,1,1
new share provide shareholder full shareholder right,1,1
cramo manager jarmo laasanen said hiring equipment machinery lithuania differs baltic country lithuania still many public structure road bridge airport shop built,1,1
vacon aim establish presence solar energy business various part world towards end said olli teva marketing director renewable energy application,1,2
replay available october following number u caller non u caller access code,1,1
tecnomen solution used prepaid post paid billing charging rating voice video call data traffic kind content service mobile fixed network,1,1
altimo teliasonera said yesterday usmanov would welcome join new company,2,1
valmet automotive report net sale eur mn operating profit eur mn,1,1
earnings per share january june eur increase year year eur,2,2
last year lemminkainen completed kouvola k supermarket contract,2,1
company expects open first online shop u summer,1,1
lay offs implemented using part time employment contract,1,0
dialing participant quote conference id,1,1
salo finland august benefon today announced plan strengthen house technology platform licensing complete mobile software platform opna long standing technology partner pollex,2,2
chief financial officer jim heindlmeyer said beyond oblivion advanced talk four major recording company service,1,1
based strong customer interest feedback using rpm mobile phone manufacturer operator enterprise developer forum significantly increase product service quality user experience cost efficiency tulonen continues,2,2
situation coated magazine printing paper continue weak,0,0
coker crane supplied tesoro corporation golden eagle refinery martinez california similar crane delivered bp castell refinery spain,1,1
capman asset manager eur bn worth asset management nordic region,1,1
eps quarter came eur eur year ago ahead forecast eur,2,2
first nine month company net loss narrowed eur eur million corresponding period,2,2
company also said poland profitability program launched oborniki steel frame sandwich panel plant,2,1
south america asia promising market,1,2
nordea moving new headquarters signifies beginning new era,2,1
teliasonera underlying result however included mln skr positive one offs hence adjusted underlying ebitda actually amount bln skr clearly expectation analyst said,0,2
previously concluded adaptation measure concerning personnel adequate time raute said,2,2
subscribe magazine,1,1
operating profit fourth quarter went eur eur corresponding period included cost growth project,0,2
majority company personnel finland temporarily laid one six week period february june period,0,0
company said estimate make slight profit thanks cost cutting measure,2,2
marimekko make sort colorful little impulse buy umbrella baby bib change purse sale better take advantage shopper ca n commit furniture want piece action,1,1
welcome,1,1
kesko agro lietuva agricultural machinery grain trader another member kesko group boosted sale percent million euro vat inclusive,2,2
name yet released,1,1
jawad williams scored point impressive debut jerusalem jason rich adding yuval naimi chipping point hapoel visit yellow blue next week,2,1
tectia corporation hel tec v provider real time security solution today announced appointed lan lan provider service uk distribute data security manage file transfer software,2,1
finnish outokumpu technology awarded several new grinding technology contract,2,2
company negotiated amendment financial covenant present credit agreement regard situation september,1,1
decision made whether group agrees import estonian meat meat product finland paper added,1,1
huhtamaki market biggest faller pct lower eur omx helsinki pct higher omx helsinki pct,0,0
resting comfortably looking forward getting back work,1,1
group operating loss eur mn profit eur mn,0,0
companiesandmarkets com provides wide range research report industry statistic competitive intelligence industrial sector,1,1
finnish electrical component maker salcomp oyj hel sal v announced today launch latest twist charger platform,1,1
company design manufacture market high quality clothing interior decoration textile bag accessory,1,1
point spread also iran iraq,1,1
neste oil responded challenge posed european union target biofuels accounting traffic fuel usage eu developing nexbtl technology producing diesel fuel renewables federation said,2,2
operating profit turnover six month period increased respectively eur eur compared corresponding period,2,2
however company saw net profit third quarter eur eur corresponding period,0,0
december finnish german telecom equipment maker nokia siemens network said today contract upgrade radio network home based telecommunication company elisa oyj hel eli v,2,2
agreement valid four year,1,2
layoff also take place suomussalmi kuhmo plant autumn result codetermination negotiation held,0,0
second quarter group net profit rose eur million eur million april june,2,2
operating profit operation finland period review totaled eur mn remaining level,1,1
among industrial stock metso added pct eur wartsila b pct eur rautaruukki k pct lower eur,1,0
finnish sampo bank danish danske bank group report profit tax eur mn eur mn,2,0
operating loss totalled eur mn compared profit eur mn second quarter,0,0
marimekko group net sale eur thousand eur thousand operating profit eur thousand eur thousand,1,1
panostaja oyj board also decided organisational meeting held upon completion agm implement agm decision concerning board member fee paid share way share transferred quarterly basis date following publication quarterly annual report,1,1
reward paid basis earning period correspond value maximum total componenta corporation share including also proportion paid cash,1,1
joint venture planning quick timetable negotiating lease potential wind farm area charting feasibility wind farm,1,1
efore result last quarter showed even faster improvement company managed better source component,2,2
kyroskoski investment completed late nekoski investment spring,1,1
latin america currently account approximately sale tecnotree company president ceo eero mertano recently told bnamericas,1,1
objective yield significant part turnover russia couple year say solteq managing director hannu ahola,1,2
effect may remain short lived however,1,1
test part larger campaign includes various customer trial demonstration make lte mhz commercially viable summer nokia siemens head lte business line reino tammela said,1,1
excited working maxi first commercial deployment master maya said joe doering head asia south region nokia siemens network,2,2
january finnish medium company alma medium corporation hel aln v said today online recruitment service monster oy partner local newspaper publisher suomen lehtiyhtyma listing job advertisement,1,1
august glaston north asian sale service region upgraded new market area north asia,1,2
topped consensus forecast earnings euro share,2,1
operating loss landed eur including one offs eur excluding one offs,1,0
finnish forestry company upm kymmene waste management company lassila tikanoja said jan planning produce ethanol energy commercial industrial waste,1,2
see market continues tight magazine paper target close deal end year,0,2
according ringman finnish paper company acquired know capacity paper recycling turned successful strategy,2,1
business sector building construction infrastructure construction technical building service,1,1
ragutis controlled finnish brewery reported per cent rise beer sale million litre held per cent market share,2,1
fair value investment property totaled eur mn eur mn,2,1
tikkurila inspires color life,1,1
finnish logistics information solution provider done solution corporation omx helsinki dso v reported wednesday october operating profit eur net sale eur period january september,1,1
finnish daily kauppalehti surmise finnish supplier rautaruukki raised price aker comfort zone,0,2
positive company recruited harri koponen ceo according affarsvarlden,1,2
third order awarded outokumpu technology shalkiya zinc kazakhstan shalkiya zinc lead project kazakhstan,2,2
administrator indicated need job cut irish insurer next month,0,0
effect saving noticeable beginning,2,1
olvi expects sale market share increase first quarter,2,2
operating profit fell eur mn eur mn,0,0
philip available comment report,1,1
featuring user interface gram model also come inch quarter vga display megabyte internal memory expandable micro secure digital slot,1,1
product delivery interrupted refiner said giving financial detail,1,1
financial term n disclosed,1,1
furthermore fully electrically driven crane environmentally friendly,2,1
order intake grew year year year year respectively eur million eur billion respective january september july september period,2,2
kemira headquartered helsinki finland international chemical group comprising business area kemira pulp paper kemira water kemira specialty kemira coating,1,1
company hoped new plant would stream end,1,1
operating profit totalled eur mn eur mn first quarter,0,0
basware invoice processing basware contract matching basware order matching basware kpi reporting tool part basware enterprise purchase pay product suite,1,1
basware einvoices oy merged parent company present fiscal period,1,1
within framework partnership nokia siemens network signed initial framework purchase agreement sitronics subsidiary jsc mikron largest manufacturer exporter microelectronic component russia,2,2
company sq office commercial building substantial amount building right new shopping center liljeholmen stockholm,1,1
pc application allows user copy file data nokia mobile device computer well create backup content,1,1
corporate update c communication ltd finnish technology group teleste corporation omx helsinki tlt v reported wednesday february operating profit eur net sale eur year,1,1
new share entitle holder dividend fiscal,1,1
maximum amount capital loan eur minimum subscription eur,1,1
group consolidated net sale totaled billion euro employ approximately person,1,1
conference call participate via conference call please dial minute beginning event europe usa,1,1
inventor ridge justin bao yiliang karczewicz marta,1,1
pharmaceutical group orion corp reported fall third quarter earnings hit larger expenditure r marketing,0,1
tietoenator pct extending recent low last week second quarter report dealer said,0,0
memorandum understanding mou party collaborate preparing implementing joint project field combined power heat generation environmental protection energy efficient technology,2,1
trade accordance agreement announced march,1,1
brazilian unit finnish security solution provider f secure signed new client last year online news source reseller web quoted division commercial director vladimir brand saying,2,1
okmetic product based high tech expertise generates added value customer innovative product development extremely efficient production process,2,1
assignment strengthens poyry position international provider engineering project service chemical process industry,2,2
release company said vocollect customer north america take advantage voice directed warehousing solution increase warehouse efficiency productivity gain discounted price,2,2
net sale decreased eur mn eur mn corresponding period,0,0
said losing five family month economy many make alternative arrangement save money,0,2
office worldwide pct net sale generated outside finland,1,1
finnish consultancy satama interactive oyj said november jarmo lonnfors took position ceo,1,2
combined foreign investment creates interesting opportunity solteq,2,1
ebit excluding non recurring item totalled eur mn eur mn,2,0
group result tax loss eur million,1,0
finnair said cancellation flight would cause daily loss x ac million u million,0,0
annual report sent automatically shareholder holding least sampo plc share,1,1
operating profit eur mn compared loss eur mn corresponding period,2,2
however two previously ordered set start producing electricity end october said,1,1
also mention improvement service follows recent expansion finnlines service bilbao via antwerp helsinki hull via helsinki st petersburg,2,1
group also strong global position fishing category,2,1
march leakage gypsum pond detected today talvivaara mine,0,1
russian official inspected damage gave vessel permission continue tallinn around norwegian registered sten nordic carrying ton gas oil manned filipino crew,1,1
broad based wig index ended thursday session pct pt blue chip wig pt,1,1
huhtamaki rigid plastic consumer good operation mainly europe separated new reporting segment january,1,1
diluted earnings per share eps rose eur eur,2,2
shipyard hope regional government andalusia offer form financial support,1,1
airline share price closed slightly x ac u helsinki,0,1
affecto expects net sale whole increase level reached eur million,2,2
company earlier said considering different strategic option struggling low cost mobile operator including divestment holding,1,2
agricultural newspaper maaseudun tulevaisuus reader representing decrease,0,0
company pledged new software would render e mail document much appear desktop computer,1,1
september finnish electrical component maker salcomp oyj hel sal v announced today launch latest twist charger platform,1,1
fortum looking invest several new production unit including new waste fired unit brista combined heat power chp plant biofuels based production unit vartan chp plant,1,1
month ago teva vice chairman phillip frost marathon venture capital fund tase mara sold protalix share,1,1
finnish raisio diagnostics launching new dna based quick test ensure safety food,2,1
north rhine westphalia issue benchmark year fixed rate deal euro,1,1
sale risen export market,2,1
say categorically wahlroos quoted saying paper asked sampo interest making bid rsa,1,1
technopolis finnish operation oulu vantaa espoo lappeenranta jyvaskyla tampere also preparing expand operation russia,1,1
kai tulonen chief technology officer sysopen digia say mobility business suite represents significant milestone company offering telecommunication industry,2,2
total floor area plant expansion square metre,1,1
complete name shareholder otto henrik bernhard nyberg information amount share transferred corresponds total number share aspo plc,1,1
liquid handling product include electronic mechanical pipette disposable tip well pipette maintenance calibration service research institution healthcare industrial laboratory,1,1
dismissed staff member take matter court unless settled outside,0,0
january finnish solution provider affecto oyj hel afe v said today eur usd contract state owned lithuanian social insurance institution sodra,2,0
name applicant jot automation oyname inventor mammila tuomo piirainen mika kellokoski mikaapplication kolnp adate filing application publication date,1,1
also said third quarter diluted eps came eur compared eur quarter year ago,2,2
forecast,1,1
period end cash cash equivalent totaled eur compared eur previous year,0,2
finnish scanfil contract manufacturer system supplier communication industrial electronics report net sale eur mn first half eur mn year earlier,0,0
operating profit totaled eur mn eur mn,2,0
device offer multimedia performance along host productivity application including live stock price,1,1
connection deal digia employ person nokia oslo silicon valley usa,1,1
according barclays f secure software protect user hacker virus spyware digital attack,1,1
singapore icis kemira indian water infrastructure firm ivrcl agreed form join venture includes new inorganic coagulant manufacturing facility andhra pradesh state india finnish water treatment chemical maker said tuesday,2,1
first nine month talvivaara net loss narrowed eur million eur million period,2,2
elcoteq expects net sale last quarter level third quarter,1,0
future plant focus production flange profile wind farm tower,1,1
net sale finnish sanoma learning literature finnish medium group sanoma decreased january june totalling eur mn eur mn corresponding period,0,0
customer include hotel restaurant well wholesaler retailer,1,1
poyry recognized one world leading advisor global forestry industry,2,2
nokia pct eur kicking morning negative territory,2,0
