text,true_label,pred_label
tom doring long successful career drive business know american market,1,1
hk ruokatalo produce many turkey product cold cut,1,2
stora enso also meeting labor authority employment economic development centre representative government order find solution,1,1
swiss bank credit suisse international act investor locomotive manufacturing plant astana administration said,1,1
divisional sale demand half remained inconsistent added,0,0
finnish exel composite technology company design manufacture market composite profile tube various industrial application report net sale decreased second quarter eur mn eur mn corresponding period,0,0
difference explained fact two shipping company stopped operating gulf finland,1,1
operating profit eur mn eur mn,2,2
acquisition sampo bank make strategic sense db say lindsey liddell director fitch rating financial institution group,2,1
qpr product family fully compatible microsoft window operating system,1,1
sale volume coca cola market share decreased,0,0
symphony service provides development service aldata gold,1,1
operating profit rose eur million,2,2
asian traffic declined per cent,0,0
glad long co operation sodra continues comment stig goran sandberg affecto area manager baltic operation,2,1
real start statutory employer employee negotiation nekoski board mill concern people,1,1
olli pekka laine appointed chairman erkki pehu lehtonen vice chairman board,1,1
another firm air liquide exempted left market,1,0
company plan spend proceeds right offering strengthening balance sheet,1,1
eur contract includes design construction work,1,1
finnish geosentric net sale decreased eur january march,0,0
customer come following country uk usa spain france italy germany china hong kong sweden norway netherlands austria belgium switzerland czech republic finland canada russia ukraine denmark ireland south korea liechtenstein,1,1
alexandria va nov erkki aho elimaki finland developed method apparatus conjunction shoe press,1,1
finnish flexible packaging manufacturer suominen corporation report net sale eur mn first quarter compared eur mn year earlier,2,0
operating profit rose eur mn eur mn,2,2
change readership significant,1,1
finnish plumbing heating system supplier uponor corporation omx helsinki unr v said tuesday august board director authorised management proceed company wide cost reduction program,2,1
revenue grew percent x ac million million x ac million,2,2
kaido kaare general director atrium eesti say company investment upgrade pig farm surpass eek mn eur mn usd mn past year,2,2
split company would series share series k share,1,1
company said agreed eur unsecured credit line lender,1,2
technopolis st petersburg government signed cooperation memorandum october set techno park neudorf production zone village strelny st petersburg suburb,2,1
new agreement expands long established cooperation company involves transfer certain engineering documentation function larox etteplan,2,2
martela said plan expand recycled furniture business elsewhere finland,2,2
also recovers valuable raw material kemira water chemical production,1,1
company build altogether new substation end year,1,2
lule municipality awarded yit year contract property management one third municipality property total area sq metre,2,1
last year firm also acquired realprojekti oy real estate development company advise capman property activity,1,1
believe however hkscan atrium start use imported meat finnish consumer prefer domestic product,1,1
talvivaara listed london stock exchange main market nasdaq omx helsinki included ftse index,1,1
q company operating loss totalled eur mn compared profit eur mn q,0,0
succeed krister kylas decided leave teliasonera,1,1
november finnish paint coating company tikkurila oyj hel tik v said today finnish state owned investment company solidium oy sold stake company total eur,1,1
market share volkswagen passenger car finland percent audi market share percent seat share percent,1,1
february finnish textile clothing company marimekko oyj hel mmo v said today preliminary operating profit grew eur eur,2,2
amanda capital investment private equity fund unquoted company mainly europe,1,1
j rvi suomen portti also planning reduce use sodium nitrite,1,1
revenue grew percent x ac billion u billion,2,2
scanfil system supplier contract manufacturer communication sector give notice productional employee temporarily lay employee company plant sievi finland,0,0
share subscription period stock option april march,1,1
finnish communication electronics component supplier scanfil oyj tuesday said sale first half lower period year ago,0,0
alexandria va dec reijo salovaara nastola finland developed veneer cutter,1,1
london afx share rautaruukki corp upgraded hold sell abn amro price target raised eur said dealer,2,1
maximum number new share offered million,1,1
planned facility estimated cost around million would largest biodiesel plant world use palm oil certified roundtable sustainable palm oil rspo,2,1
performance second half exceeded expectation,2,0
group revenue amounted eur million company currently employ approximately people,1,1
light bright pretty addition life also keep penny bank account,1,1
finland city forssa said pay compensation food industry company hk ruokatalo atrium lye leak tap water occurred march,0,1
separate announcement helsinki stock exchange atrium revealed company third quarter profit declined eur third quarter last year eur year q,0,0
plant collect raw material baltic sea region,1,1
increase capital stock registered finnish trade register november,2,1
total two offer received contracting authority participating contract however contract allotted affecto finland oy,1,1
adp news feb finnish wood product technology supplier raute oyj hel rutav said today net profit decreased eur million usd eur million,0,0
use validation rule base enables verifying processing rule base managed different administrator fulfil set requirement,1,1
choose basware tool financial service seemed like natural continuation cooperation say tommi leskinen financial application manager neste oil corporation,1,1
outotec currently delivering new oil shale processing plant eesti energia estonia based enefit technology developed jointly eesti energia outotec,1,1
broker initiated palfinger ag konecranes oyj buy recommendation eur price target respectively,2,2
upon completion sale proha would get usd stake artemis,1,1
transaction included also transfer lease agreement concerning manufacturing premise employment agreement related operation,1,1
sale healthcare trade business support oriola kd strategy focus pharmaceutical wholesale retail business,2,1
agreement benefon forthcoming range twig integrated gps navigation mobile phone device use jointly developed web based tracking location technology consumer commercial application,1,1
deal already approved shareholder carried first half,1,1
nokia strong track record lower end handset market said july touch screen offering would come year cheaper rival model order tap higher volume market,2,2
kiosk cinema operation suffered particular,0,1
uranium found locally naturally occurring make sense extract way metal,1,2
disposal autotank also strengthen aspo capital structure commented gustav nyberg ceo aspo,2,1
mr k r vasantha appointed managing director incap contract manufacturing service pvt ltd,1,1
refining margin year bbl compared bbl prior year,2,2
second quarter raute net loss narrowed eur eur million period,2,2
america represents gemalto billing latin america one fastest growing region company,1,2
construction project scheduled start second quarter new building scheduled place end,1,1
insolvency act regulates amount debt borrower permitted write,1,1
would like see changed nokia next attempt,1,1
dragonfly love another video shot start finish using nokia n,1,1
join technopolis kone held various position within group recently director service business business development kone middle eastern operation,1,1
change built model design communicated subcontractor accommodate steel grc glass reinforced concrete fabrication process,1,1
fixing home base cutting cost closing non profitable unit looking going forward said,2,2
cision say sale return u k operation profitability,2,2
part transaction nekoski paper mill remained real ownership continued galerie art production sappi long term contract,1,2
public service also available,1,1
name newspaper publishing printing division sanoma changed sanoma news,1,1
operating profit turnover six month period increased respectively eur eur compared corresponding period year ago,2,2
restructuring creates efficient organization increased operational focus stable profitability lead efficient production said bo annvik head specialty stainless,2,2
company enhance gprs capability existing idea telecom service area add service area network,2,1
sale increased due growing market rate increased operation,2,2
contract comprise turnkey order roro system two roro cruise vessel construction viking line tallink,1,2
rapala estimate net sale increase pct pct assuming exchange rate,2,2
diluted earnings per share eps stood eur versus eur,0,0
fi developing cooperation keyword advertising microsoft,2,2
cooperation involve arena partner buying share new joint venture company operating alma medium home sale vehicle consumer advertising marketplace business,1,1
company anticipates turnover whole surpass previous year eur million,2,2
q april finnish forest machinery equipment maker ponsse oyj hel pon v said today expects swing net profit eur first quarter eur loss year earlier,2,2
honored acknowledged commitment industry especially asia pacific,2,1
following impact altima hit utility pole causing live electric line fall onto roadway,1,1
letter economic affair minister listed estonian shipping company tallink asks approval entitled cut port fee,1,1
okmetic closed plant espoo early production line site moved okmetic plant vantaa finland texas usa,1,1
loss period totalled eur mn compared profit eur mn,0,0
posted turnover mln euro mln operating profit mln euro mln,1,1
total value project valued sek bn eur bn usd bn,1,1
unilever turun sinappi made sweden hold market,1,1
symbian foundation plan revise procedure testing signing software digitally signing trojan symbian mobile phone operating system mistake,1,1
cv proposed member available viewing march onwards internet www sampo com ir,1,1
city user search home property area city active even outside country,1,1
geosolutions team provides intriguing new technology combining gps mobile based technology together internet based social networking,1,2
componenta metal sector company international operation production plant located finland netherlands sweden turkey,1,1
glaston headquartered tampere finland growing international glass technology company,2,1
order consist total panel lift away weatherdeck hatch cover delivered container vessel capacity ranging teus,1,1
g data subscriber also helping maintain growth level since data subscription push multiple sim ownership,1,1
recent interview financial time ft sampo board chairman bjorn wahlroos said p c certainly sale price set sek billion confirming earlier statement,1,2
benefon wireless gps technology company supply karputer twig navigation platform gps satellite navigation voice guidance service,2,1
reported operating margin negative,0,1
operating loss eur mn compared loss eur mn second quarter,2,2
combined capital fund expected eur mn mn,1,1
india high priority since business link two country also expanding tornstrom said,1,2
truck feature eco drive system fuel measuring tool store data particular individual driver,1,1
financial detail available,1,1
march goldman sachs estimate negative prospect norwegian mobile operation norway telenor asa osl tel sweden teliasonera ab sto tlsn short term,0,2
costanza light aluminum base washable shade come white pistachio orange blue red,1,1
october december sale mln eur pct increase year year,2,2
web marela application handle invitation quote quote comparison agreement purchase invoice inspection inventory management delivery,1,1
finnish solution provider affecto oyj said today frame contract valued eur implement next phase insurance application south african mutual federal insurance company limited f,2,1
company also seeking possibility relocate luumaki personnel people upm mill,1,1
company said sale three month end march slid eur u eur last year,0,2
vacon cash flow operation grew eur mn eur mn year ago,2,2
february finnish privacy security software developer tectia oyj hel tec v said wednesday set two strategic business unit managed security mobile authentication,1,1
finnish printed circuit board pcbs maker aspocomp group oyj said december named henry gilchrist senior vice president group asian operation january,1,1
includes option additional communal building site well construction supervision work construction site,1,1
luxembourg registered investment fund amber trust ii final approval lithuania competition council acquire percent sanitas country largest pharmaceutical producer,2,1
government professional approach assessing offer,2,1
currently company us eight similar reach stacker four empty container handler konecranes,1,1
first solteq service company operating st petersburg area include maintenance material management system data collection solution,1,1
israeli cable network operator hot telecom chosen teleste international technology group exclusive provider fttx equipment israel according teleste today,2,1
board director propose dividend eur per share eur per share paid,2,1
research show access information technology one limiting factor small business especially work heterogenous network based environment,1,1
real said ground rumor circulating market month,1,2
operating loss increased eur mn loss eur mn,0,2
contract traded time high ton april,1,1
ferry run trouble outside stockholm archipelago made island,0,0
kauko telko ltd press release telko group kauko telko expanding strategic partnership bp industrial lubricant service bp il acquiring total ownership bp swedish retail company molub alloy ab,2,1
transaction take place without payment merger consideration,1,1
repeat order follow successfully installed elevator delhi metro system kone spokeswoman told thomson financial news,2,2
energy sector accounted approximately steel industry transportation volume,1,1
fixed acquisition price amount nok approximately eur million additional price nok eur million maximum,1,1
action include cutting expensive weekend shift freezing production bonus system general cost cutting program,1,2
donation granted aalto university university helsinki tampere turku eastern finland jyv skyl oulu vaasa polytechnic announced later,1,1
technopolis set aside plot land measuring hectare build park mikkonen said,1,1
capman office helsinki stockholm copenhagen oslo manages nordic buyout mezzanine technology life science real estate fund approximately eur bn total capital,1,1
huhtamaki continue invest organic growth,1,2
pleased receive nomination committee request confidence say jon risfelt,2,1
offer million share aimed raise x ac million u million expected completed oct outokumpu said,1,1
following acquisition relacom strengthen presence finland serving operator office market mobile fixed network construction installation maintenance service,2,1
ebrd using fund provide million loan b portion million euro syndicated two finnish commercial bank nordea bank finland plc million euro pohjola bank plc million euro,1,1
also strengthen ruukki offshore business,2,2
h kan dahlstr head mobility service teliasonera forecast mobile data volume teliasonera network sweden rise eight fold tb,2,1
shopping center prime location right next myllypuro metro station,2,1
check make bid deka showroom fortitude valley,1,1
seminar introduced modern clean technology product financial tool sponsorship program energy environment project well potential develop clean energy vietnam,2,1
cargotec net sale exceeded eur billion,1,2
alexandria va aug timo vataja tampere finland virve inget oulu finland developed computer program product activating right use,1,1
airbus firm order nonbinding commitment,2,1
combined value order eur mn,1,1
decision sell share lenenergo reached line fortum strategic plan invest mainly generating asset russia lenenergo grid company press release said,2,1
owner participated business operation company continue poyry employment transaction,1,1
past year factory produced many nokia popular model including nokia nokia well nokia latest music device nokia express music,1,1
copying republication redistribution afx news content including framing similar mean expressly prohibited without prior written consent afx news,1,1
upm kymmene working closely shipping agent reduce fuel consumption greenhouse gas emission,2,1
event also viewed live webcast www cargotec com,1,1
nordea coordinate syndicated loan,1,1
sale seppala diminished per cent,0,1
elcoteq global network market service site long experience serving consumer electronics system solution customer,1,2
installation automatic varnishing line important part company strategy region central eastern europe said jozef misurec director ruukki slovakia,2,2
welcome,1,1
mercator use software logistic retail wholesale operation slovenia market southeastern europe,1,1
kemira r organization comprises approximately people company said,1,1
aho proud company new product lordi cola,1,1
investor continue interested company share although quite cheap affarsvarlden said,2,1
sale improved sek mn compared sek mn,2,2
net sale fell third quarter eur mn,0,0
microsoft last week also issued first patch window operating system beta released day earlier,1,1
october finnish wood product technology supplier raute oyj hel rutav said today swung net profit eur first nine month versus net loss eur period year earlier,2,2
q bank land net interest income increased eur mn eur mn,2,2
apple inc iphone wo n change game plan verizon communication inc chief executive ivan seidenberg said wednesday,1,0
ssh communication security corporation headquartered helsinki finland,1,1
also construction expense gone russia,0,2
tekla defense business employ person located espoo finland,1,1
move carried transferring hkscan production related property plant equipment well holding subsidiary associate company country hkscan finland,1,1
counter competitor strength target weakness,1,2
company share quoted nasdaq omx helsinki rautaruukki oyj rtrks,1,1
subject matter invention furthermore use cyclone separating partly molten particle,1,1
nokia enough user well,1,1
copying republication redistribution afx news content inculding framing similar mean expressly prohibited without prior written consent afx news,1,1
finnish metal industry solution supplier outotec oyj net profit rose mln euro mln first nine month mln euro mln period,2,2
today business pre empt consumer want said mohammed zainalabedin general manager zain bahrain,1,1
company eur bn asset count among five largest shareholder finnish insurer ilmarinen varma well finnish state pension fund ver,1,1
tekla group net sale approximately million euro,1,1
prerequisite inclusion program receipt gain key employee acquire aspo share amount determined board advance maximum,1,1
company make marketing sale investment initiated even efficient,2,1
merger two telecom operator expected result world fourth largest telecom operator,1,1
employee leaf company within duration cover money invested ensure commitment returned company,1,1
proha plc euronext announced today may fully owned subsidiary safran software solution agreed sell share safran north america llc sna holding investment group based norway,1,1
contract cover hdo platform ac cxe optical fttb node designed increase forward return path capacity transmission network,2,2
appointment kaupthing bank aim co ordinate capital market activity within group improve overall service client,2,1
intel atom processor tremendous success marketplace since launch year ago said pankaj kedia director global ecosystem program intel corp ultra mobility group,2,2
finnish high technology provider vaahto group report net sale eur mn accounting period september february increase year earlier,2,2
look vintage fabric cushion cover coffee pot ceramic serving dish cocktail glass stainless steel party dish,1,1
structure bim building information modeling software tekla model based software provider adopted construction management delivery university project abu dhabi,1,1
capital base capital adequacy measurement based approach basel ii,1,1
raisio site main production plant well company headquarters,1,1
finnish engineering technology company metso oyj said may completed acquisition paper machinery technology japanese engineering company mitsubishi heavy industry mhi undisclosed sum,2,2
part agreement employee john deere forestry documentation function transfer dokumentori oy,1,1
bg ad bulgaria leading internet company,2,1
addition company reduce maximum ten job,0,1
border guard service banned mooring company car shipping ferry test travel railroad car terminal russian port border checkpoint yet ready,0,1
beijing xfn asia hong kong listed standard chartered bank said signed china mobile phone dealer financing agreement nokia making first foreign bank offer financing country small medium enterprise lr,2,1
evidentiary hearing investigation scheduled april may,1,1
wellness service important future,1,1
mika stahlberg vp f secure lab said excited proud f secure recognized av comparative product year,2,2
bank see potential getinge share rise,2,1
company reportedly searching replacement ceo olli pekka kallasvuo,1,1
ixonos rich heritage developing leadership experience smartphone segment,2,2
company also said november real estate fund ky signed agreement finnish window maker fenestra oy build window plant forssa southern finland,2,1
therefore seems finnish shipping company viking line get subsidy need order new lng fuelled vessel,2,1
france l com spent time studying teliasonera potential takeover target shareholder want sell pellissier said,1,1
fixed mobile convergence solution represent key value proposition today communication market,1,1
last year sysopen digia invested ibm product know building portal trading place system successfully implemented customer solution supported,2,1
dividend paid april shareholder record date april entered list shareholder kept finnish central security depository ltd,1,1
plan cs worked together public policy management institute ppmi partner building total area square meter built territory first phase,1,1
said thing different new finnish nuclear power station go operation large hydro powered station northern europe good year,1,2
according deputy md pekka silvennoinen aim double turnover next three year,2,2
company expects net sale whole remain level,0,1
department store sale improved eur mn,2,2
value order eur,1,1
russian medium venture minority shareholder peter hervy denied plan sell ovum press daily said,1,1
panostaja financially secure finnish multi field corporation creates healthy company company entity,1,1
omx nordic omxn index comprising traded nordic stock nasdaq omx exchange closed point wednesday,2,0
total value order placed aspo marine transportation subsidiary esl shipping oy eur million usd,1,1
rautalinko resposnible also mobility service job division continued marek hintze,1,1
okhta center area expected square metre office premise,1,1
january finnish software solution provider basware hel ba v said yesterday adjusted strategy goal next four year focus international growth mainly via acquisition,1,2
company profit totaled l h year year,0,2
nokia multimedia net sale totaled eur bn corresponding period,2,2
result russia import restriction finnish dairy company canceled august,2,0
china finnish kone provides elevator escalator solution modernisation maintenance build escalator installed high speed railway section beijing shanghai year time,2,2
value order usd mn,1,1
addition employee laid notice whole workforce laid short period needed,0,0
dollar fell though pound yen,0,0
finnish cutlery hand tool maker fiskars oyj abp hel fisa said today net profit rose eur million usd third quarter eur million year earlier,2,2
boomerang boat net sale eur mn made operating profit eur mn,1,1
beginning negotiation estimated number reduction maximum,1,0
latin america currently account approximately sale finnish bs os va supplier telecom operator tecnotree company president ceo eero mertano told bnamericas,1,1
strong brand visibility nationally regionally primary importance home sale vehicle consumer advertising,1,1
compensation news opinion distribution,1,1
pleased working fujitsu ntt docomo advance progress lte said juergen walter head converged core nokia siemens network,2,2
expensive water brand finland moment,1,1
operating profit six month period decreased eur net sale increased eur compared corresponding period,0,0
february finnish industrial machinery company metso oyj hel meo v said today deliver mineral processing equipment basic engineering canadian miner northland resource osl naur tse nau,2,2
report full year result august,1,0
raisio malting capacity full use,2,1
glaston well known brand bavelloni pre processing machine tool tamglass uniglass safety glass machine albat wirsam software solution,1,1
bawag issue benchmark covered deal,1,1
nordea bank estonia part largest financial group nordic country,1,1
addition supplying new headbox modern sizing coating unit vaahto group provide erection supervision training start service,1,1
russia video international group hold controlling stake russian medium venture,1,1
antibody administered repeated dos mg kg generally well tolerated pharmacokinetic characteristic btt psoriasis patient consistent observed previously completed study rheumatoid arthritis ra patient,1,1
